question,questionAnswer,policy,control,answer
"Do you have a documented, and tested, business continuity/disaster recovery plan?","
 s_1. Are formal business continuity procedures developed and documented?
Yes
 s_2. Is there an established Business Resiliency program that has been approved by management and communicated to appropriate constituents?
Yes
 s_3. Is there a formal Incident Response Plan?
Yes
 s_4. Is there a periodic (at least annual) review of your Business Resiliency Program?
Yes
 s_5. Is there a Business Resiliency policy defined, reviewed and approved on a periodic cadence? If yes, please provide the frequency under comments box.
Yes
BCP reviewed yearly.
","
 p_1.  or source a suitable program of training in BCM and BC risk management

Identify appropriate levels of training and awareness for BC Coordinators, to enable cascade through their areas of activity to affect a strong BC culture across Signifi

Organize exercises of the BC Plans, and advise on local exercising arrangements Prepare and monitor the annual resilience work/ action plan

Enforcement	

All instances of non-compliance will be reviewed by the department director. The department director, with the assistance of the Human Resources department has the authority to impose disciplinary actions, up to and including termination of employment or contractual agreement.

Update	

This policy and all supporting documentation will be reviewed and updated annually or upon material changes to Signifi business rules, technology processes, organizational goals, or information security objectives to ensure its continuing suitability, adequacy, and effectiveness.

Revision History

	Appendix A - Definitions

Business Continuity Management System (BCMS)


 p_2. All rights reserved

No part of this document may be reproduced in any form, including photocopying or transmission electronically to any computer, without prior written consent of Signifi Solutions Inc (from now on, Signifi). The information contained in this document is proprietary to Signifi and may not be used or disclosed except as expressly authorized in writing by Signifi.

Trademarks

Other product names mentioned in this document may be trademarks or registered trademarks of their respective companies and are hereby acknowledge

Document Control

The electronic version of this document is recognized as the only valid version.

Approval History

Document Sensitivity Level

Confidential

Introduction

The aim of having a Business Continuity Management System (BCMS) is to ensure that the Signifi is able to maintain its activities in the face of disruptive challenges. Therefore, all Signifi services and resources owned, leased, or supported by Signifi are expected to prepare, exercise,
 p_3.  ensure that BCP’s are reviewed at least annually, or earlier if subject to significant change and that any new system or activity has documented BC procedures that augment wider Business Area planning.

Signifi BCGB and its BCO will provide adequate education and training as well as testing and exercising to validate its plans at regular intervals to ensure awareness of the requirements of this policy.

On completion of BCP’s they should be stored securely with both an electronic and hard copy available locally as well as utilizing existing software within the resilience portal of the Signifi Intranet and properly version controlled by the BCO.

BC planning is a dynamic, iterative, composite process, which allows for further development and adaptation as circumstances change or risks evolve.

Strategic BCM Aim

To develop, implement and manage a robust and effective BCMS to protect Signifi operations, including users which include but not limited to employees, contractors, part-time and temporary workers
 p_4. acy, and effectiveness.

Revision History

	Appendix A - Definitions

Business Continuity Management System (BCMS)

An ongoing Management and governance process supported Signifi Senior Management Team and appropriately resourced to implement and maintain Business Continuity Management.

Business Continuity Management (BCM)

The holistic management process that identifies potential threats to Signifi and provides a framework for building resilience and the capability for an effective response that safeguards the interests of Signifi

Business Continuity (BC)

The capability for Signifi to plan for and respond to incidents and business disruptions in order to continue business operations at an acceptable predefined level.

Business Continuity Incident (BCI)

An event or occurrence that disrupts an organization’s ability to deliver normal service and where contingency arrangements are required to return them to an acceptable level.

Business Continuity Governance Board (BCGB)

A strategic level group convened by
 p_5.  it may be necessary to escalate the response. Signifi ERCG, whose representatives are pre-determined from across Signifi to provide leadership, Coordination, communication, and decision making during such a disruptive event.

BCP – Recovery Schedule

Please Note: 

Signifi will apply all efforts to ensure the above RPO and RTO timelines are met. 


Incident reporting and debriefing

Business continuity incidents should be reported and debriefs coordinated to ensure that learning and review informs continuous improvement.

Procurement

Signifi has a number of suppliers and partners on whom it relies upon to provide a continued service. In order to minimize any risk of disruption by failure to supply a product or service, suppliers and partners identified as critical in the relevant Business Impact Analysis will be requested to provide assurances that they have BC arrangements in place. Any organization tendering for Signifi contracts may be asked to complete a BC planning questionnaire.
","
 c_1. ACCESS CONTROL: CONTINGENCY PLANNING
AC-1: CP-8(4)
Access Control Policy And Procedures: Provider Contingency Plan
This control addresses the establishment of policy and procedures for the effective implementation of selected security controls and control enhancements in the AC family. Policy and procedures reflect applicable federal laws, Executive Orders, directives, regulations, policies, standards, and guidance. Security program policies and procedures at the organization level may make the need for system-specific policies and procedures unnecessary. The policy can be included as part of the general information security policy for organizations or conversely, can be represented by multiple policies reflecting the complex nature of certain organizations. The procedures can be established for the security program in general and for particular information systems, if needed. The organizational risk management strategy is a key factor in establishing policy and procedures.: Reviews of provider contingency plans consider the proprietary nature of such plans. In some situations, a summary of provider contingency plans may be sufficient evidence for organizations to satisfy the review requirement. Telecommunications service providers may also participate in ongoing disaster recovery exercises in coordination with the Department of Homeland Security, state, and local governments. Organizations may use these types of activities to satisfy evidentiary requirements related to service provider contingency plan reviews, testing, and training.
 c_2. ACCESS CONTROL: CONTINGENCY PLANNING
AC-1: CP-6(3)
Access Control Policy And Procedures: Accessibility
This control addresses the establishment of policy and procedures for the effective implementation of selected security controls and control enhancements in the AC family. Policy and procedures reflect applicable federal laws, Executive Orders, directives, regulations, policies, standards, and guidance. Security program policies and procedures at the organization level may make the need for system-specific policies and procedures unnecessary. The policy can be included as part of the general information security policy for organizations or conversely, can be represented by multiple policies reflecting the complex nature of certain organizations. The procedures can be established for the security program in general and for particular information systems, if needed. The organizational risk management strategy is a key factor in establishing policy and procedures.: Area-wide disruptions refer to those types of disruptions that are broad in geographic scope (e.g., hurricane, regional power outage) with such determinations made by organizations based on organizational assessments of risk. Explicit mitigation actions include, for example: (i) duplicating backup information at other alternate storage sites if access problems occur at originally designated alternate sites; or (ii) planning for physical access to retrieve backup information if electronic accessibility to the alternate site is disrupted.
 c_3. ACCESS CONTROL: CONTINGENCY PLANNING
AC-1: CP-6
Access Control Policy And Procedures: Alternate Storage Site
This control addresses the establishment of policy and procedures for the effective implementation of selected security controls and control enhancements in the AC family. Policy and procedures reflect applicable federal laws, Executive Orders, directives, regulations, policies, standards, and guidance. Security program policies and procedures at the organization level may make the need for system-specific policies and procedures unnecessary. The policy can be included as part of the general information security policy for organizations or conversely, can be represented by multiple policies reflecting the complex nature of certain organizations. The procedures can be established for the security program in general and for particular information systems, if needed. The organizational risk management strategy is a key factor in establishing policy and procedures.: Alternate storage sites are sites that are geographically distinct from primary storage sites. An alternate storage site maintains duplicate copies of information and data in the event that the primary storage site is not available. Items covered by alternate storage site agreements include, for example, environmental conditions at alternate sites, access rules, physical and environmental protection requirements, and coordination of delivery/retrieval of backup media. Alternate storage sites reflect the requirements in contingency plans so that organizations can maintain essential missions/business functions despite disruption, compromise, or failure in organizational information systems.
 c_4. ACCESS CONTROL: CONTINGENCY PLANNING
AC-1: CP-9
Access Control Policy And Procedures: Information System Backup
This control addresses the establishment of policy and procedures for the effective implementation of selected security controls and control enhancements in the AC family. Policy and procedures reflect applicable federal laws, Executive Orders, directives, regulations, policies, standards, and guidance. Security program policies and procedures at the organization level may make the need for system-specific policies and procedures unnecessary. The policy can be included as part of the general information security policy for organizations or conversely, can be represented by multiple policies reflecting the complex nature of certain organizations. The procedures can be established for the security program in general and for particular information systems, if needed. The organizational risk management strategy is a key factor in establishing policy and procedures.: System-level information includes, for example, system-state information, operating system and application software, and licenses. User-level information includes any information other than system-level information. Mechanisms employed by organizations to protect the integrity of information system backups include, for example, digital signatures and cryptographic hashes. Protection of system backup information while in transit is beyond the scope of this control. Information system backups reflect the requirements in contingency plans as well as other organizational requirements for backing up information.
 c_5. ACCESS CONTROL: CONTINGENCY PLANNING
AC-1: CP-4(1)
Access Control Policy And Procedures: Coordinate With Related Plans
This control addresses the establishment of policy and procedures for the effective implementation of selected security controls and control enhancements in the AC family. Policy and procedures reflect applicable federal laws, Executive Orders, directives, regulations, policies, standards, and guidance. Security program policies and procedures at the organization level may make the need for system-specific policies and procedures unnecessary. The policy can be included as part of the general information security policy for organizations or conversely, can be represented by multiple policies reflecting the complex nature of certain organizations. The procedures can be established for the security program in general and for particular information systems, if needed. The organizational risk management strategy is a key factor in establishing policy and procedures.: Plans related to contingency plans for organizational information systems include, for example, Business Continuity Plans, Disaster Recovery Plans, Continuity of Operations Plans, Crisis Communications Plans, Critical Infrastructure Plans, Cyber Incident Response Plans, and Occupant Emergency Plans. This control enhancement does not require organizations to create organizational elements to handle related plans or to align such elements with specific plans. It does require, however, that if such organizational elements are responsible for related plans, organizations should coordinate with those elements.
",Yes.
