question,questionAnswer,policy,control,answer
"Do you determine, prioritize, and treat cybersecurity risks related to your operation?","
 s_1. Do you have a vulnerability management program (e.g. vulnerability scans, penetration tests, patch management, etc.)?
Yes
 s_2. Is there a formal Incident Response Plan?
Yes
 s_3. Has your company suffered a data loss or security breach within the last 3 years?
No
 s_4. Are reasonable physical security and environmental controls present in the office buildings and data center?
Yes
 s_5. Does your company follow a formal OS (Unix, Linux, Windows) hardening standards?
Yes
","
 p_1.  and executed actions needed to address those risks. To address risks, control activities have been placed into operation to help ensure that the actions are carried out correctly and efficiently. Control activities serve as mechanisms for managing the achievement of security and availability.

Selection and Development of Control Activities

Signifi utilizes the risk assessments results to prioritize the information security risks and take the appropriate actions for implementing controls selected to mitigate risks. Risk analysis is an essential process for the entity's success. It includes identification of key business processes where potential exposures of some consequence exist. Once the significance and likelihood of risk have been assessed, management considers how the risk should be managed. This involves judgment based on assumptions about the risk, and reasonable analysis of costs associated with reducing the risk level. Necessary actions are taken to reduce the significance or likelihood of the risk occurring, and identification of the control activities necessary to mitigate the risk.

Update	

This policy and all supporting documentation will be reviewed and updated annually
 p_2.  risk of compromise while in being used. 

Will the ability to provide critical services be impacted? How? For how long?

When should the Cyber insurance carrier be notified? (See Error! Reference source not found.) 

Is a legal investigation or other action likely? Does evidence need to be preserved? 

How likely is the containment step to succeed? What is the end result, full containment or partial?

What resources are required to support the containment activity?

What is the potential damage to equipment and other resources?

What is the expected duration of the solution? (Temporary, short-term, long-term, or permanent)

Should IR team members act discretely to attempt to hide their activities from the attacker?

Is the assistance of a third party required? What is the expected response time?

Do interested parties (customers, partners, investors) need to be notified?  If so, when
 p_3.  risk of compromise while in being used. 

Will the ability to provide critical services be impacted? How? For how long?

When should the Cyber insurance carrier be notified? (See Error! Reference source not found.) 

Is a legal investigation or other action likely? Does evidence need to be preserved? 

How likely is the containment step to succeed? What is the end result, full containment or partial?

What resources are required to support the containment activity?

What is the potential damage to equipment and other resources?

What is the expected duration of the solution? (Temporary, short-term, long-term, or permanent)

Should IR team members act discretely to attempt to hide their activities from the attacker?

Is the assistance of a third party required? What is the expected response time?

Do interested parties (customers, partners, investors) need to be notified?  If so, when
 p_4.  Management Guide for Information Technology Systems” is performed on annual basis in order to identify possible threats and vulnerabilities to security of Signifi information systems and assets that may contain Highly Confidential and Confidential information. The risk assessments must also be performed following any major changes to the environment. 

Review and update of Information Security Policy:

Following the execution of a risk assessment, Information Security shall provide a report to the Executive Management Team to consider and to address or mitigate any risks identified.

Risk versus Cost Benefit Analysis

The assessment of counter measures must be performed through a cost-benefit analysis where controls to mitigate risks are selected to reduce to a level acceptable to management. This analysis may be based on any of the following:

The cost of the control compared to the benefit of minimizing the risk.

Management’s appetite for risk (i.e., the level of residual risk that the management is prepared to accept).


Vulnerability Management


 p_5.  believed to have been at risk of compromise while in being used. 

Will the ability to provide critical services be impacted? How? For how long?

When should the Cyber insurance carrier be notified? (See Contact Information) 

Is a legal investigation or other action likely? Does evidence need to be preserved? 

How likely is the containment step to succeed? What is the end result, full containment or partial?

What resources are required to support the containment activity?

What is the potential damage to equipment and other resources?

What is the expected duration of the solution? (Temporary, short-term, long-term, or permanent)

Should IR team members act discretely to attempt to hide their activities from the attacker?

Is the assistance of a third party required? What is the expected response time?

Do interested parties (customers, partners, investors) need to be notified?  If so,
","
 c_1. ACCESS CONTROL: CONTINGENCY PLANNING
AC-1: CP-2(8)
Access Control Policy And Procedures: Identify Critical Assets
This control addresses the establishment of policy and procedures for the effective implementation of selected security controls and control enhancements in the AC family. Policy and procedures reflect applicable federal laws, Executive Orders, directives, regulations, policies, standards, and guidance. Security program policies and procedures at the organization level may make the need for system-specific policies and procedures unnecessary. The policy can be included as part of the general information security policy for organizations or conversely, can be represented by multiple policies reflecting the complex nature of certain organizations. The procedures can be established for the security program in general and for particular information systems, if needed. The organizational risk management strategy is a key factor in establishing policy and procedures.: Organizations may choose to carry out the contingency planning activities in this control enhancement as part of organizational business continuity planning including, for example, as part of business impact analyses. Organizations identify critical information system assets so that additional safeguards and countermeasures can be employed (above and beyond those safeguards and countermeasures routinely implemented) to help ensure that organizational missions/business functions can continue to be conducted during contingency operations. In addition, the identification of critical information assets facilitates the prioritization of organizational resources. Critical information system assets include technical and operational aspects. Technical aspects include, for example, information technology services, information system components, information technology products, and mechanisms. Operational aspects include, for example, procedures (manually executed operations) and personnel (individuals operating technical safeguards and/or executing manual procedures). Organizational program protection plans can provide assistance in identifying critical assets.
 c_2. ACCESS CONTROL: SYSTEM AND INFORMATION INTEGRITY
AC-1: SI-4(17)
Access Control Policy And Procedures: Integrated Situational Awareness
This control addresses the establishment of policy and procedures for the effective implementation of selected security controls and control enhancements in the AC family. Policy and procedures reflect applicable federal laws, Executive Orders, directives, regulations, policies, standards, and guidance. Security program policies and procedures at the organization level may make the need for system-specific policies and procedures unnecessary. The policy can be included as part of the general information security policy for organizations or conversely, can be represented by multiple policies reflecting the complex nature of certain organizations. The procedures can be established for the security program in general and for particular information systems, if needed. The organizational risk management strategy is a key factor in establishing policy and procedures.: This control enhancement correlates monitoring information from a more diverse set of information sources to achieve integrated situational awareness. Integrated situational awareness from a combination of physical, cyber, and supply chain monitoring activities enhances the capability of organizations to more quickly detect sophisticated cyber attacks and investigate the methods and techniques employed to carry out such attacks. In contrast to SI-4 (16) which correlates the various cyber monitoring information, this control enhancement correlates monitoring beyond just the cyber domain. Such monitoring may help reveal attacks on organizations that are operating across multiple attack vectors.
 c_3. ACCESS CONTROL: RISK ASSESSMENT
AC-1: RA-6
Access Control Policy And Procedures: Technical Surveillance Countermeasures Survey
This control addresses the establishment of policy and procedures for the effective implementation of selected security controls and control enhancements in the AC family. Policy and procedures reflect applicable federal laws, Executive Orders, directives, regulations, policies, standards, and guidance. Security program policies and procedures at the organization level may make the need for system-specific policies and procedures unnecessary. The policy can be included as part of the general information security policy for organizations or conversely, can be represented by multiple policies reflecting the complex nature of certain organizations. The procedures can be established for the security program in general and for particular information systems, if needed. The organizational risk management strategy is a key factor in establishing policy and procedures.: Technical surveillance countermeasures surveys are performed by qualified personnel to detect the presence of technical surveillance devices/hazards and to identify technical security weaknesses that could aid in the conduct of technical penetrations of surveyed facilities. Such surveys provide evaluations of the technical security postures of organizations and facilities and typically include thorough visual, electronic, and physical examinations in and about surveyed facilities. The surveys also provide useful input into risk assessments and organizational exposure to potential adversaries.
 c_4. ACCESS CONTROL: INCIDENT RESPONSE
AC-1: IR-10
Access Control Policy And Procedures: Integrated Information Security Analysis Team
This control addresses the establishment of policy and procedures for the effective implementation of selected security controls and control enhancements in the AC family. Policy and procedures reflect applicable federal laws, Executive Orders, directives, regulations, policies, standards, and guidance. Security program policies and procedures at the organization level may make the need for system-specific policies and procedures unnecessary. The policy can be included as part of the general information security policy for organizations or conversely, can be represented by multiple policies reflecting the complex nature of certain organizations. The procedures can be established for the security program in general and for particular information systems, if needed. The organizational risk management strategy is a key factor in establishing policy and procedures.: Having an integrated team for incident response facilitates information sharing. Such capability allows organizational personnel, including developers, implementers, and operators, to leverage the team knowledge of the threat in order to implement defensive measures that will enable organizations to deter intrusions more effectively. Moreover, it promotes the rapid detection of intrusions, development of appropriate mitigations, and the deployment of effective defensive measures. For example, when an intrusion is detected, the integrated security analysis team can rapidly develop an appropriate response for operators to implement, correlate the new incident with information on past intrusions, and augment ongoing intelligence development. This enables the team to identify adversary TTPs that are linked to the operations tempo or to specific missions/business functions, and to define responsive actions in a way that does not disrupt the mission/business operations. Ideally, information security analysis teams are distributed within organizations to make the capability more resilient.
 c_5. ACCESS CONTROL: INCIDENT RESPONSE
AC-1: IR-6
Access Control Policy And Procedures: Incident Reporting
This control addresses the establishment of policy and procedures for the effective implementation of selected security controls and control enhancements in the AC family. Policy and procedures reflect applicable federal laws, Executive Orders, directives, regulations, policies, standards, and guidance. Security program policies and procedures at the organization level may make the need for system-specific policies and procedures unnecessary. The policy can be included as part of the general information security policy for organizations or conversely, can be represented by multiple policies reflecting the complex nature of certain organizations. The procedures can be established for the security program in general and for particular information systems, if needed. The organizational risk management strategy is a key factor in establishing policy and procedures.: The intent of this control is to address both specific incident reporting requirements within an organization and the formal incident reporting requirements for federal agencies and their subordinate organizations. Suspected security incidents include, for example, the receipt of suspicious email communications that can potentially contain malicious code. The types of security incidents reported, the content and timeliness of the reports, and the designated reporting authorities reflect applicable federal laws, Executive Orders, directives, regulations, policies, standards, and guidance. Current federal policy requires that all federal agencies (unless specifically exempted from such requirements) report security incidents to the United States Computer Emergency Readiness Team (US-CERT) within specified time frames designated in the US-CERT Concept of Operations for Federal Cyber Security Incident Handling.
","Yes, ACME Co. utilizes risk assessments to prioritize information security risks and takes appropriate actions to implement controls selected to mitigate risks."
