question,questionAnswer,policy,control,answer
"Is a process in place to wipe data from hardware before it is disposed or reused in a way that meets required compliance sets. (e.g. degaussing, cryptographic wiping, disk shredding, etc.)","
 s_1. Provide a detailed description of application or service under consideration by Qualcomm
Digital Lockers & Vending from Signifi offer secure and simple ways for users
to access or purchase goods at their convenience. Digital Vending gives end-users secure purchasing options for corporate approved peripherals.
Digital Lockers provide secure storage and pickup/drop-off capabilities for a variety of use cases  for example businesses who are providing end-user device repair and support or for businesses looking for audit-able and monitored storage of company ownedtools or assets.
 s_2. Is there a removable media (CDs, DVDs, tapes, disk drives) policy or program that has been approved by management, communicated to appropriate constituents, and an owner to maintain and review the policy?
Yes
 s_3. Are electronic systems used to transmit, process or store data?
Yes
 s_4. How does your company secure sensitive information on removable media (e.g., USB drive, external hard drives, DVDs, etc.)?
Policy restricting sensitive data on media.
Controls restricting data from being copied to removable media.
Controls enforcing encryption on removable media
No controls in place
We are working on implementing controls for encryption of removable media. Policy does not allow users to copy customer data to their workstations and removable media.
 s_5. Are business information systems used to transmit, process or store data?
Yes
","
 p_1.  operating systems are removed.


Reuse and redistribution of IT Equipment

IT department manager will undertake the necessary secure procedures to ensure any sensitive data is removed before IT equipment is redistributed.


Certification and Audit

Successful deletion and destruction must be evidenced, and certification must be obtained and recorded at all times.

Asset Inventory

Details must be recorded and updated within the IT department manager’s inventory database to ensure the Signifi has an up-to-date record of active IT assets.

Data Backup 

It is the explicit responsibility of the owner/requestor of the IT asset to ensure that all relevant data has been sufficiently removed from the IT device and backed up before requesting disposal and/or prior to the scheduled pickup.

IT Asset Roles and Responsibilities

Requestor 

All IT disposal requests must be requested via an IT Disposal Request Form ,which is completed and submitted to IT department manager.


 p_2.  form or another via the IT equipment we use. The Hardware Decommissioning Policy and its associated policies are concerned with managing the secure disposal of IT equipment assets which are owned by the Signifi and are no longer required.

Principles

This policy defines the roles and responsibilities of staff in ensuring the secure disposal of Signifi IT equipment.

All Signifi employees, part-time and temporary workers, trainees, contractors and vendors who use information assets have a responsibility to handle them appropriately and in accordance with their classification

Signifi information assets should be made available to all who have a legitimate need for them 

The integrity of information assets must be maintained at all times. Information assets that are used in conjunction with the IT asset must also be accurate, complete, timely and consistent with other related information and events.

Scope

This policy applies to all users which include but not limited to employees, contractors, part-time and temporary workers, trainees
 p_3.  and other devices that process and store Signifi data. 

To provide advice on the appropriate methods of destruction of physical media. 

To ensure sensitive information assets stored via the IT equipment is sufficiently backed up, copied and/or removed prior to being disposed of. 

To ensure an auditable trail of disposal/destruction is evidenced.

Implementation

Procedures will be put in place to ensure effective use of the Signifi IT Hardware Decommissioning Policy. These procedures include: 

Clear identification of Signifi information assets and protection in line with the asset classification scheme. 

Implementation of procedures for the disposal of Signifi IT assets. 

Ensuring that disposal procedures are adhered to. 

Provision of certification and audit trail for asset disposal.

Disposal/Destruction of Physical Media


The Signifi has a number of cross-cut shredders and confidential waste disposal
 p_4. All rights reserved

No part of this document may be reproduced in any form, including photocopying or transmission electronically to any computer, without prior written consent of Signifi Solutions Inc (from now on, Signifi). The information contained in this document is proprietary to Signifi and may not be used or disclosed except as expressly authorized in writing by Signifi.

Trademarks

Other product names mentioned in this document may be trademarks or registered trademarks of their respective companies and are hereby acknowledged.

Document Control

The electronic version of this document is recognized as the only valid version.

Approval History

Document Sensitivity Level

Confidential

Introduction

Overview

Information and IT equipment are vital assets to any organization, and virtually all of our activities involve creating or handling information in one form or another via the IT equipment we use. The Hardware Decommissioning Policy and its associated policies are concerned with managing the secure disposal of IT
 p_5.  by a third party, the Service Level Agreement should specify the level of protection required.

Backup media should be tested at least quarterly to ensure that they can be relied upon for emergency use when necessary.

Restoration procedures should be checked and tested at least annually to ensure that they are effective and that they can be completed within the time allotted in the operational procedures for recovery.


Disposal and Destruction of Signifi Data

At the end of the retention period, PI and any copies of the PI that are no longer required for the purposes for which it was collected, will be destroyed or rendered anonymous.

Where PI is rendered anonymous, an effective anonymization or pseudonymization algorithm and program will be applied.  After anonymization or pseudonymization the source files will be destroyed in a secure manner.

Signifi will determine and will document in procedures, the method(s) for destroying or permanently erasing media containing PI, application software or security critical system data
","
 c_1. ACCESS CONTROL: MEDIA PROTECTION
AC-1: MP-6(8)
Access Control Policy And Procedures: Remote Purging / Wiping Of Information
This control addresses the establishment of policy and procedures for the effective implementation of selected security controls and control enhancements in the AC family. Policy and procedures reflect applicable federal laws, Executive Orders, directives, regulations, policies, standards, and guidance. Security program policies and procedures at the organization level may make the need for system-specific policies and procedures unnecessary. The policy can be included as part of the general information security policy for organizations or conversely, can be represented by multiple policies reflecting the complex nature of certain organizations. The procedures can be established for the security program in general and for particular information systems, if needed. The organizational risk management strategy is a key factor in establishing policy and procedures.: This control enhancement protects data/information on organizational information systems, system components, or devices (e.g., mobile devices) if such systems, components, or devices are obtained by unauthorized individuals. Remote purge/wipe commands require strong authentication to mitigate the risk of unauthorized individuals purging/wiping the system/component/device. The purge/wipe function can be implemented in a variety of ways including, for example, by overwriting data/information multiple times or by destroying the key necessary to decrypt encrypted data.
 c_2. ACCESS CONTROL: PHYSICAL AND ENVIRONMENTAL PROTECTION
AC-1: PE-3(5)
Access Control Policy And Procedures: Tamper Protection
This control addresses the establishment of policy and procedures for the effective implementation of selected security controls and control enhancements in the AC family. Policy and procedures reflect applicable federal laws, Executive Orders, directives, regulations, policies, standards, and guidance. Security program policies and procedures at the organization level may make the need for system-specific policies and procedures unnecessary. The policy can be included as part of the general information security policy for organizations or conversely, can be represented by multiple policies reflecting the complex nature of certain organizations. The procedures can be established for the security program in general and for particular information systems, if needed. The organizational risk management strategy is a key factor in establishing policy and procedures.: Organizations may implement tamper detection/prevention at selected hardware components or tamper detection at some components and tamper prevention at other components. Tamper detection/prevention activities can employ many types of anti-tamper technologies including, for example, tamper-detection seals and anti-tamper coatings. Anti-tamper programs help to detect hardware alterations through counterfeiting and other supply chain-related risks.
 c_3. ACCESS CONTROL: MEDIA PROTECTION
AC-1: MP-6
Access Control Policy And Procedures: Media Sanitization
This control addresses the establishment of policy and procedures for the effective implementation of selected security controls and control enhancements in the AC family. Policy and procedures reflect applicable federal laws, Executive Orders, directives, regulations, policies, standards, and guidance. Security program policies and procedures at the organization level may make the need for system-specific policies and procedures unnecessary. The policy can be included as part of the general information security policy for organizations or conversely, can be represented by multiple policies reflecting the complex nature of certain organizations. The procedures can be established for the security program in general and for particular information systems, if needed. The organizational risk management strategy is a key factor in establishing policy and procedures.: This control applies to all information system media, both digital and non-digital, subject to disposal or reuse, whether or not the media is considered removable. Examples include media found in scanners, copiers, printers, notebook computers, workstations, network components, and mobile devices. The sanitization process removes information from the media such that the information cannot be retrieved or reconstructed. Sanitization techniques, including clearing, purging, cryptographic erase, and destruction, prevent the disclosure of information to unauthorized individuals when such media is reused or released for disposal. Organizations determine the appropriate sanitization methods recognizing that destruction is sometimes necessary when other methods cannot be applied to media requiring sanitization. Organizations use discretion on the employment of approved sanitization techniques and procedures for media containing information deemed to be in the public domain or publicly releasable, or deemed to have no adverse impact on organizations or individuals if released for reuse or disposal. Sanitization of non-digital media includes, for example, removing a classified appendix from an otherwise unclassified document, or redacting selected sections or words from a document by obscuring the redacted sections/words in a manner equivalent in effectiveness to removing them from the document. NSA standards and policies control the sanitization process for media containing classified information.
 c_4. ACCESS CONTROL: MEDIA PROTECTION
AC-1: MP-6(3)
Access Control Policy And Procedures: Nondestructive Techniques
This control addresses the establishment of policy and procedures for the effective implementation of selected security controls and control enhancements in the AC family. Policy and procedures reflect applicable federal laws, Executive Orders, directives, regulations, policies, standards, and guidance. Security program policies and procedures at the organization level may make the need for system-specific policies and procedures unnecessary. The policy can be included as part of the general information security policy for organizations or conversely, can be represented by multiple policies reflecting the complex nature of certain organizations. The procedures can be established for the security program in general and for particular information systems, if needed. The organizational risk management strategy is a key factor in establishing policy and procedures.: This control enhancement applies to digital media containing classified information and Controlled Unclassified Information (CUI). Portable storage devices can be the source of malicious code insertions into organizational information systems. Many of these devices are obtained from unknown and potentially untrustworthy sources and may contain malicious code that can be readily transferred to information systems through USB ports or other entry portals. While scanning such storage devices is always recommended, sanitization provides additional assurance that the devices are free of malicious code to include code capable of initiating zero-day attacks. Organizations consider nondestructive sanitization of portable storage devices when such devices are first purchased from the manufacturer or vendor prior to initial use or when organizations lose a positive chain of custody for the devices.
 c_5. ACCESS CONTROL: ACCESS CONTROL
AC-1: AC-7(2)
Access Control Policy And Procedures: Purge / Wipe Mobile Device
This control addresses the establishment of policy and procedures for the effective implementation of selected security controls and control enhancements in the AC family. Policy and procedures reflect applicable federal laws, Executive Orders, directives, regulations, policies, standards, and guidance. Security program policies and procedures at the organization level may make the need for system-specific policies and procedures unnecessary. The policy can be included as part of the general information security policy for organizations or conversely, can be represented by multiple policies reflecting the complex nature of certain organizations. The procedures can be established for the security program in general and for particular information systems, if needed. The organizational risk management strategy is a key factor in establishing policy and procedures.: This control enhancement applies only to mobile devices for which a logon occurs (e.g., personal digital assistants, smart phones, tablets). The logon is to the mobile device, not to any one account on the device. Therefore, successful logons to any accounts on mobile devices reset the unsuccessful logon count to zero. Organizations define information to be purged/wiped carefully in order to avoid over purging/wiping which may result in devices becoming unusable. Purging/wiping may be unnecessary if the information on the device is protected with sufficiently strong encryption mechanisms.
","Yes, the Hardware Decommissioning Policy ensures that sensitive data is removed before IT equipment is redistributed and procedures are in place for the disposal of ACME IT assets, including the disposal and destruction of physical media containing sensitive information."
