question,questionAnswer,policy,control,answer
"Do you have a dedicated security authority for the organization, e.g. CISO?","
 s_1. Is there a information security function responsible for security initiatives?
The Director of Technology - head of IT - is also the Chief Security Officer.
 s_2. Is there an information security policy that has been approved by management, communicated to appropriate constituents and an owner to maintain and review the policy?
Yes
 s_3. Does the company have a documented Incident Management program?
Yes
 s_4. Is there a security awareness training program for all personnel (employees and consultants)?
Yes
 s_5. Are reasonable physical security and environmental controls present in the office buildings and data center?
Yes
","
 p_1. , conducted to help ensure employees are meeting their goals and objectives as defined during the review process

Senior Leadership Oversight

Signifi recognizes that effective information security management is critical to its business and clients and strives to continually deliver high-quality service that includes protecting both Signifi and client data from internal and external threats. 

The Signifi board of directors and senior management team are dedicated to creating and executing appropriate security policies company wide. To ensure its information security management program is fully integrated and supports the business requirements, Signifi’s Chief Information Security Officer has been appointed by the board of directors and senior leadership to define and implement specific security-related policies, which are annually reviewed and endorsed by the senior management team.

Signifi’s senior management team also commits to the following oversight activities:

Setting policy objectives focused on reducing risk, identifying acceptable information security risk levels, and establishing overarching company policy relating to information management, hardware, networks, and software.

 p_2.  to information security incidents within the following guidelines:

Contain and clear threats that have caused harm or have the potential to cause harm to Signifi’ systems and assets

Where deemed necessary perform forensic preservation of evidence using trained staff or external service providers

Treat all incidents and related information as confidential and report/escalate incidents involving unauthorized access and/or hacking to the Chief Executive Officer or Chief Information Officer or Legal Counsel.

The CSIRT should not perform any of the following without prior written authorization from the Chief Executive Officer or Chief Information Officer:

Perform counter-measures or attacks against potential attackers, computer systems or networks that are not owned by the Signifi; and

Communicate with law enforcement, media, or other external parties.

In instances where physical or electronic asset(s) of Signifi are stolen off-premises, associates are required to report the incident to Law Enforcement and the Information Security team or Corporate Facilities immediately. 
 p_3.  network.

Vendor must restrict access to security logs to authorized individual only and protect logs from unauthorized access.

Ensure network and system hardening is performed at least once every sis (6) months.

Monitor firewall at the perimeter and internally, as necessary.

Subservice organizations should provide Signifi yearly with a SOC 2 report.


Administrative Requirements

The Vendor should ensure that:

Vendor should establish, implement and maintain reasonable policies and a program of organization, operational, administrative, physical and technical and organizational security.

Vendor must take reasonable steps to prevent unauthorized physical or electronic access to or loss of Signifi’s confidential and services, systems, devices or media containing this information.

Vendor must employ risk assessment processes and procedures to regularly assess systems used to provide services or products to Signifi.

Vendor must limit and monitor physical access to its facilities.

Vendor must have a clean
 p_4. All rights reserved

No part of this document may be reproduced in any form, including photocopying or transmission electronically to any computer, without prior written consent of Signifi (from now on, Signifi). The information contained in this document is proprietary to Signifi and may not be used or disclosed except as expressly authorized in writing by Signifi.

Trademarks

Other product names mentioned in this document may be trademarks or registered trademarks of their respective companies and are hereby acknowledged.


Document Control

The electronic version of this document is recognized as the only valid version.

Approval History

Document Sensitivity Level

Confidential

Introduction

Overview

Effective security will always be dependent on people. As a result, security can only be effective if employees know what is expected of them and what their responsibilities are. They should know why various security measures, such as locked doors, securing confidential information, access control and use of login IDs
 p_5.  shall ensure that:

Confidentiality, Integrity and Availability of all information assets and data shall be maintained and available on a need-to-know basis.

Information will be protected against any and all unauthorized access.

The Local Area Network and Wide Area Network of Signifi will be secured, by implementing controls to safeguard the network from all possible attack vectors either intentional or unintentional.

Disaster Recovery plans must be maintained, reviewed, and tested as far as practical.

Information Security Awareness training will be imparted to all relevant Associates to have continual improvements in the ways of data security.

Legislative, regulatory, and contractual requirements will be met; and

All actual or suspected information security breaches will be reported to the appropriate entities and will be thoroughly investigated.

The Chief Executive Officer and Chief Information Officer have approved and support the overarching Information Security policy and all supporting policy framework documents.  To that end, the following operational support is stipulated
","
 c_1. ACCESS CONTROL: SECURITY ASSESSMENT AND AUTHORIZATION
AC-1: CA-6
Access Control Policy And Procedures: Security Authorization
This control addresses the establishment of policy and procedures for the effective implementation of selected security controls and control enhancements in the AC family. Policy and procedures reflect applicable federal laws, Executive Orders, directives, regulations, policies, standards, and guidance. Security program policies and procedures at the organization level may make the need for system-specific policies and procedures unnecessary. The policy can be included as part of the general information security policy for organizations or conversely, can be represented by multiple policies reflecting the complex nature of certain organizations. The procedures can be established for the security program in general and for particular information systems, if needed. The organizational risk management strategy is a key factor in establishing policy and procedures.: Security authorizations are official management decisions, conveyed through authorization decision documents, by senior organizational officials or executives (i.e., authorizing officials) to authorize operation of information systems and to explicitly accept the risk to organizational operations and assets, individuals, other organizations, and the Nation based on the implementation of agreed-upon security controls. Authorizing officials provide budgetary oversight for organizational information systems or assume responsibility for the mission/business operations supported by those systems. The security authorization process is an inherently federal responsibility and therefore, authorizing officials must be federal employees. Through the security authorization process, authorizing officials assume responsibility and are accountable for security risks associated with the operation and use of organizational information systems. Accordingly, authorizing officials are in positions with levels of authority commensurate with understanding and accepting such information security-related risks. OMB policy requires that organizations conduct ongoing authorizations of information systems by implementing continuous monitoring programs. Continuous monitoring programs can satisfy three-year reauthorization requirements, so separate reauthorization processes are not necessary. Through the employment of comprehensive continuous monitoring processes, critical information contained in authorization packages (i.e., security plans, security assessment reports, and plans of action and milestones) is updated on an ongoing basis, providing authorizing officials and information system owners with an up-to-date status of the security state of organizational information systems and environments of operation.  To reduce the administrative cost of security reauthorization, authorizing officials use the results of continuous monitoring processes to the maximum extent possible as the basis for rendering reauthorization decisions.
 c_2. ACCESS CONTROL: SYSTEM AND INFORMATION INTEGRITY
AC-1: SI-5
Access Control Policy And Procedures: Security Alerts, Advisories, And Directives
This control addresses the establishment of policy and procedures for the effective implementation of selected security controls and control enhancements in the AC family. Policy and procedures reflect applicable federal laws, Executive Orders, directives, regulations, policies, standards, and guidance. Security program policies and procedures at the organization level may make the need for system-specific policies and procedures unnecessary. The policy can be included as part of the general information security policy for organizations or conversely, can be represented by multiple policies reflecting the complex nature of certain organizations. The procedures can be established for the security program in general and for particular information systems, if needed. The organizational risk management strategy is a key factor in establishing policy and procedures.: The United States Computer Emergency Readiness Team (US-CERT) generates security alerts and advisories to maintain situational awareness across the federal government. Security directives are issued by OMB or other designated organizations with the responsibility and authority to issue such directives. Compliance to security directives is essential due to the critical nature of many of these directives and the potential immediate adverse effects on organizational operations and assets, individuals, other organizations, and the Nation should the directives not be implemented in a timely manner. External organizations include, for example, external mission/business partners, supply chain partners, external service providers, and other peer/supporting organizations.
 c_3. ACCESS CONTROL: PROGRAM MANAGEMENT
AC-1: PM-15
Access Control Policy And Procedures: Contacts With Security Groups And Associations
This control addresses the establishment of policy and procedures for the effective implementation of selected security controls and control enhancements in the AC family. Policy and procedures reflect applicable federal laws, Executive Orders, directives, regulations, policies, standards, and guidance. Security program policies and procedures at the organization level may make the need for system-specific policies and procedures unnecessary. The policy can be included as part of the general information security policy for organizations or conversely, can be represented by multiple policies reflecting the complex nature of certain organizations. The procedures can be established for the security program in general and for particular information systems, if needed. The organizational risk management strategy is a key factor in establishing policy and procedures.: Ongoing contact with security groups and associations is of paramount importance in an environment of rapidly changing technologies and threats. Security groups and associations include, for example, special interest groups, forums, professional associations, news groups, and/or peer groups of security professionals in similar organizations. Organizations select groups and associations based on organizational missions/business functions. Organizations share threat, vulnerability, and incident information consistent with applicable federal laws, Executive Orders, directives, policies, regulations, standards, and guidance.
 c_4. ACCESS CONTROL: PROGRAM MANAGEMENT
AC-1: PM-3
Access Control Policy And Procedures: Information Security Resources
This control addresses the establishment of policy and procedures for the effective implementation of selected security controls and control enhancements in the AC family. Policy and procedures reflect applicable federal laws, Executive Orders, directives, regulations, policies, standards, and guidance. Security program policies and procedures at the organization level may make the need for system-specific policies and procedures unnecessary. The policy can be included as part of the general information security policy for organizations or conversely, can be represented by multiple policies reflecting the complex nature of certain organizations. The procedures can be established for the security program in general and for particular information systems, if needed. The organizational risk management strategy is a key factor in establishing policy and procedures.: Organizations consider establishing champions for information security efforts and as part of including the necessary resources, assign specialized expertise and resources as needed. Organizations may designate and empower an Investment Review Board (or similar group) to manage and provide oversight for the information security-related aspects of the capital planning and investment control process.
 c_5. ACCESS CONTROL: PROGRAM MANAGEMENT
AC-1: PM-12
Access Control Policy And Procedures: Insider Threat Program
This control addresses the establishment of policy and procedures for the effective implementation of selected security controls and control enhancements in the AC family. Policy and procedures reflect applicable federal laws, Executive Orders, directives, regulations, policies, standards, and guidance. Security program policies and procedures at the organization level may make the need for system-specific policies and procedures unnecessary. The policy can be included as part of the general information security policy for organizations or conversely, can be represented by multiple policies reflecting the complex nature of certain organizations. The procedures can be established for the security program in general and for particular information systems, if needed. The organizational risk management strategy is a key factor in establishing policy and procedures.: Organizations handling classified information are required, under Executive Order 13587 and the National Policy on Insider Threat, to establish insider threat programs. The standards and guidelines that apply to insider threat programs in classified environments can also be employed effectively to improve the security of Controlled Unclassified Information in non-national security systems. Insider threat programs include security controls to detect and prevent malicious insider activity through the centralized integration and analysis of both technical and non-technical information to identify potential insider threat concerns. A senior organizational official is designated by the department/agency head as the responsible individual to implement and provide oversight for the program. In addition to the centralized integration and analysis capability, insider threat programs as a minimum, prepare department/agency insider threat policies and implementation plans, conduct host-based user monitoring of individual employee activities on government-owned classified computers, provide insider threat awareness training to employees, receive access to information from all offices within the department/agency (e.g., human resources, legal, physical security, personnel security, information technology, information system security, and law enforcement) for insider threat analysis, and conduct self-assessments of department/agency insider threat posture. Insider threat programs can leverage the existence of incident handling teams organizations may already have in place, such as computer security incident response teams. Human resources records are especially important in this effort, as there is compelling evidence to show that some types of insider crimes are often preceded by nontechnical behaviors in the workplace (e.g., ongoing patterns of disgruntled behavior and conflicts with coworkers and other colleagues). These precursors can better inform and guide organizational officials in more focused, targeted monitoring efforts. The participation of a legal team is important to ensure that all monitoring activities are performed in accordance with appropriate legislation, directives, regulations, policies, standards, and guidelines.
","Yes, the Director of Technology is also the Chief Security Officer."
